{
  "timestamp": "2026-05-30T12:05:00.000000+0000",
  "flow_id": 6000001,
  "in_iface": "eth1",
  "event_type": "ssh",
  "src_ip": "10.10.1.1",
  "src_port": 22,
  "dest_ip": "10.10.1.10",
  "dest_port": 34567,
  "proto": "TCP",
  "ssh": {
    "version": "SSH-2.0-OpenSSH_9.5",
    "server_version": "SSH-2.0-OpenSSH_9.5",
    "client_proto": "publickey",
    "server_proto": "publickey",
    "client_software": "OpenSSH_9.5",
    "server_software": "OpenSSH_9.5"
  }
}
