{
  "timestamp": "2026-05-30T12:04:00.000000+0000",
  "flow_id": 5000001,
  "in_iface": "eth1",
  "event_type": "tls",
  "src_ip": "10.10.1.10",
  "src_port": 49154,
  "dest_ip": "198.51.100.90",
  "dest_port": 443,
  "proto": "TCP",
  "tls": {
    "version": "TLS 1.3",
    "sni": "secure.example.com",
    "subject": "CN=secure.example.com",
    "issuerdn": "CN=Example CA",
    "fingerprint": "aa:bb:cc:dd:ee:ff:00:11:22:33:44:55:66:77:88:99:aa:bb:cc:dd",
    "notbefore": "2026-01-01T00:00:00+0000",
    "notafter": "2027-01-01T00:00:00+0000"
  }
}
